{
  "package": {
    "name": "Reviewer",
    "version": "0.1.0",
    "generated_at": "2026-06-30T17:10:45.011860+00:00",
    "builder_skill_version": "0.1.0",
    "compiler_model": "api/mercury-2",
    "output_mode": "full_package"
  },
  "source_dependency": {
    "canonical_url": "https://en.wikipedia.org/wiki/Wikipedia:Signs_of_AI_writing",
    "source_title": "Wikipedia:Signs of AI writing - Wikipedia",
    "active_source_version": "source_v1",
    "local_source_file": "source.md",
    "last_checked_at": "2026-06-30T17:10:45.011860+00:00",
    "last_successful_fetch_at": "2026-06-30T17:10:45.011860+00:00",
    "normalized_hash": "fac2b228b01a9fe4",
    "archive_urls": [],
    "update_mode": "monitored",
    "promotion_policy": "manual_approval",
    "fallback_order": [
      "local_copy",
      "wayback_snapshot",
      "secondary_archive",
      "previous_version"
    ]
  },
  "ingestion": {
    "mode": "text-first",
    "text_extraction_confidence": "high",
    "visual_extraction_enabled": false,
    "reconciliation_required": false,
    "visual_artifacts": [],
    "routing_notes": "Prose-dominant source; text-first ingestion selected."
  },
  "source_fit": {
    "overall_fit": "high",
    "rule_density": "high",
    "procedure_density": "low",
    "example_density": "high",
    "stability": "low",
    "specificity": "high",
    "composability": "high",
    "fit_notes": "High rule density \u2014 good candidate for reviewer or rewriter skill. High example density \u2014 examples can anchor skill output format. Visual signals detected \u2014 consider hybrid or visual-first ingestion."
  },
  "opportunity_summary": {
    "recommended_action": "build_one_skill",
    "recommended_skill_type": "reviewer",
    "candidate_skill_types": [
      {
        "type": "reviewer",
        "confidence": "high",
        "build_timing": "now",
        "why_fit": "High rule density maps directly to a reviewer checklist.",
        "needed_extras": []
      },
      {
        "type": "rewriter",
        "confidence": "medium",
        "build_timing": "now",
        "why_fit": "Rules and examples together support rewrite targets.",
        "needed_extras": []
      },
      {
        "type": "reference_companion",
        "confidence": "medium",
        "build_timing": "later",
        "why_fit": "Any content-rich page can support a reference companion skill.",
        "needed_extras": [
          "cross-links to related pages"
        ]
      }
    ]
  },
  "governance": {
    "criticality": "medium",
    "review_required_for_promotion": true,
    "auto_update_threshold": "never",
    "change_classification_policy": "trivial_moderate_material",
    "policy_notes": "Review all source changes before promoting an updated skill."
  },
  "context_used": {
    "project_memory": false,
    "project_files": false,
    "project_instructions": false,
    "related_skills": false,
    "user_preferences": false,
    "context_notes": "Generated by lsd CLI."
  },
  "artifacts": {
    "readme_file": "README.md",
    "skill_file": "SKILL.md",
    "source_file": "source.md",
    "source_policy_file": "source-policy.md",
    "opportunity_map_file": "skill-opportunities.md",
    "extraction_report_file": "extraction-report.md",
    "changelog_file": "CHANGELOG.md",
    "visual_files": []
  }
}